{
  "schema_version": "0.1.0",
  "agent_id": "agt_meridian_reply",
  "agent_version": "3.0.0",
  "owner": "Ari Rios",
  "purpose": "Triage inbound casework and draft responses for human review.",
  "environment": "uk-south-prod",
  "created_at": "2026-09-03T00:00:00.000Z",
  "components": {
    "model": {
      "provider": "anthropic",
      "model": "claude-sonnet-5",
      "version": "2026-04-01"
    },
    "prompt_digest": "sha256:2f1a…c9",
    "memory": {
      "scope": "case",
      "retentionDays": 30
    },
    "tools": [
      {
        "id": "case.read"
      },
      {
        "id": "document.read"
      },
      {
        "id": "response.draft"
      },
      {
        "id": "review.request"
      }
    ],
    "data_sources": [
      "case-store",
      "document-store"
    ],
    "guardrails": [
      "pii-redaction",
      "injection-filter"
    ],
    "identity": {
      "principal": "svc-meridian-reply",
      "scope": "case-owner"
    },
    "dependencies": [
      "retrieval-svc",
      "model-api"
    ],
    "mcp_servers": [
      "mcp:case-store@1.2"
    ],
    "index_content_sources": [
      "internal:policy-library"
    ],
    "memory_write_policy": {
      "writers": [
        "agent"
      ],
      "retention": "30d",
      "rollback": "enabled"
    },
    "model_artifact_digest": "sha256:4c1e…7b"
  },
  "operating": {
    "autonomy_level": "assisted",
    "human_review": {
      "externalSend": "required",
      "caseUpdate": "required"
    },
    "recovery_objectives": {
      "rto": "30m",
      "rpo": "5m"
    },
    "permissions": [
      "case:read",
      "document:read",
      "draft:create",
      "review:request"
    ]
  },
  "entitlement": {
    "provider_plan": "enterprise",
    "account_binding": "org:meridian-council",
    "data_processing_terms": {
      "promptRetention": "none",
      "trainingUse": "prohibited"
    },
    "data_residency": "uk",
    "expiry": "2027-03-31"
  },
  "containment": {
    "network_egress": "deny-all",
    "permitted_destinations": [
      "case-store.internal",
      "model-api.anthropic.com"
    ],
    "sandbox_image": "meridian-agent-sandbox:3.1.0",
    "package_registries": [
      "internal-mirror.meridian.gov.uk"
    ],
    "shared_storage": [],
    "inter_agent_channels": [],
    "max_concurrent_instances": "4",
    "safety_classifiers": [
      "cyber-refusal",
      "pii-redaction",
      "injection-filter"
    ],
    "shutdown_mechanism": "identity-revocation+gateway-kill",
    "credential_scopes": [
      "case:read@15m"
    ]
  },
  "observability": {
    "logging_destination": "siem:meridian-immutable",
    "log_plane": "independent",
    "monitoring_plane": "independent",
    "evaluation_harness": "inspect@0.3.44",
    "scorer_config": "sha256:9d02…af"
  },
  "digest": "sha256:b34b4f8ec5ed659bf615dfb4b0573b65f8509cd39f9bd73122cf17c49699d46f"
}
